{
  "contract_version": "1.0",
  "child_id": "child-demo",
  "session_id": "session-demo",
  "turn_id": "rpg-turn-001",
  "previous_turn_id": null,
  "device_id": "rx5-demo-001",
  "input_kind": "object_observed",
  "utterance": "",
  "asr": null,
  "emotion": null,
  "detected_object": "fridge",
  "perception_event_id": "perception-object-001"
}
